[
  {
    "id": "rote-linsen",
    "name": { "de": "Rote Linsen", "en": "Red lentils" },
    "category": "huelsenfruechte",
    "nutrition": {
      "kcal": 116,
      "protein_g": 9.0,
      "fat_g": 0.4,
      "carbs_g": 16.9,
      "fiber_g": 7.9,
      "salt_g": 0,
      "sugar_g": 1.8,
      "micros": ["eisen", "folat", "zink"]
    },
    "typical_portion": {
      "grams": 200,
      "label": { "de": "1 Tasse, gekocht", "en": "1 cup, cooked" }
    },
    "cost_tier": 1,
    "convenience_tier": 2,
    "eco": {
      "co2_tier": 1,
      "co2_kg_per_kg": 0.9,
      "note": {
        "de": "Hülsenfrüchte gehören zu den klimafreundlichsten Eiweißquellen überhaupt.",
        "en": "Pulses are among the most climate-friendly protein sources there are."
      }
    },
    "tags": ["vegan", "vegetarisch", "glutenfrei", "proteinquelle", "ballaststoffquelle", "vorratstauglich"],
    "blurb": {
      "de": "Der vielleicht beste Einstieg in Hülsenfrüchte: Rote Linsen müssen nicht eingeweicht werden und sind in 10–15 Minuten weich. Sie zerfallen beim Kochen – perfekt für Suppen, Currys und Bolognese-Varianten, weniger für Salate (dafür: Belugalinsen). Günstig, lange haltbar, viel Eiweiß und Ballaststoffe in einem.",
      "en": "Possibly the easiest entry into pulses: red lentils need no soaking and cook soft in 10–15 minutes. They fall apart while cooking – perfect for soups, curries and bolognese-style sauces, less so for salads (use beluga lentils there). Cheap, long shelf life, and plenty of protein and fibre in one."
    },
    "swaps": ["hackfleisch-gemischt", "belugalinsen", "kichererbsen"],
    "allergens": []
  },
  {
    "id": "skyr-natur",
    "name": { "de": "Skyr (natur)", "en": "Skyr (plain)" },
    "category": "milchprodukte",
    "nutrition": {
      "kcal": 63,
      "protein_g": 11.0,
      "fat_g": 0.2,
      "carbs_g": 4.0,
      "fiber_g": 0,
      "salt_g": 0.1,
      "sugar_g": 4.0,
      "micros": ["calcium", "b12", "jod"]
    },
    "typical_portion": {
      "grams": 150,
      "label": { "de": "1 kleiner Becher", "en": "1 small tub" }
    },
    "cost_tier": 2,
    "convenience_tier": 1,
    "eco": {
      "co2_tier": 2,
      "note": {
        "de": "Milchprodukt, aber deutlich klimafreundlicher als Käse: Für Skyr wird Magermilch verwendet.",
        "en": "A dairy product, but far more climate-friendly than cheese: skyr is made from skimmed milk."
      }
    },
    "tags": ["vegetarisch", "glutenfrei", "proteinquelle", "schnell"],
    "blurb": {
      "de": "Isländischer Frischkäse, der sich wie Joghurt löffelt: sehr viel Eiweiß, fast kein Fett, angenehm säuerlich. Die Natur-Variante mit eigenem Obst schlägt die vorgezuckerten Sorten deutlich – der Blick auf die Zutatenliste lohnt sich hier besonders. Ideal als Frühstück oder schnelle Eiweißantwort am Abend.",
      "en": "Icelandic fresh cheese that eats like yoghurt: lots of protein, almost no fat, pleasantly tart. The plain version with your own fruit clearly beats the pre-sweetened ones – this is a product where checking the ingredient list really pays off. Ideal for breakfast or as a quick evening protein answer."
    },
    "swaps": ["magerquark", "griechischer-joghurt", "sojajoghurt-natur"],
    "allergens": ["laktose"]
  }
]
